{
  "fields": [
    {
      "authorityId": "JQ-CONFIG-LOWER-HEIGHT-001",
      "defaultValue": 34.5,
      "id": "lowerCabinetHeight",
      "label": "Lower cabinet height",
      "layouts": [
        "fireplace-wall",
        "door-wall",
        "window-wall"
      ],
      "max": 48,
      "min": 24,
      "required": true,
      "reset": "default",
      "step": 0.25,
      "stepId": "customization",
      "type": "number",
      "unit": "in"
    },
    {
      "authorityId": "JQ-CONFIG-LOWER-DEPTH-001",
      "defaultValue": 24,
      "id": "lowerCabinetDepth",
      "label": "Lower cabinet depth",
      "layouts": [
        "fireplace-wall",
        "door-wall",
        "window-wall"
      ],
      "max": 30,
      "min": 12,
      "required": true,
      "reset": "default",
      "step": 0.25,
      "stepId": "customization",
      "type": "number",
      "unit": "in"
    },
    {
      "authorityId": "JQ-CONFIG-OVERHEAD-DEPTH-001",
      "defaultValue": 12,
      "id": "overheadDepth",
      "label": "Overhead bookcase depth",
      "layouts": [
        "fireplace-wall",
        "door-wall",
        "window-wall"
      ],
      "max": 20,
      "min": 8,
      "required": true,
      "reset": "default",
      "step": 0.25,
      "stepId": "customization",
      "type": "number",
      "unit": "in"
    },
    {
      "authorityId": "JQ-CONFIG-TOE-KICK-HEIGHT-001",
      "defaultValue": 4,
      "id": "toeKickHeight",
      "label": "Toe-kick height",
      "layouts": [
        "fireplace-wall",
        "door-wall",
        "window-wall"
      ],
      "max": 8,
      "min": 0,
      "required": true,
      "reset": "default",
      "step": 0.25,
      "stepId": "customization",
      "type": "number",
      "unit": "in"
    },
    {
      "authorityId": "JQ-CONFIG-TOP-FASCIA-HEIGHT-001",
      "defaultValue": 3,
      "id": "topFasciaHeight",
      "label": "Top-fascia height",
      "layouts": [
        "fireplace-wall",
        "door-wall",
        "window-wall"
      ],
      "max": 12,
      "min": 0,
      "required": true,
      "reset": "default",
      "step": 0.25,
      "stepId": "customization",
      "type": "number",
      "unit": "in"
    },
    {
      "authorityId": "JQ-CONFIG-BASE-TYPE-001",
      "defaultValue": "flush",
      "id": "baseType",
      "label": "Base type",
      "layouts": [
        "fireplace-wall",
        "door-wall",
        "window-wall"
      ],
      "required": true,
      "reset": "default",
      "stepId": "customization",
      "type": "radio",
      "values": [
        {
          "label": "Flush",
          "value": "flush"
        },
        {
          "label": "Recessed",
          "value": "recessed"
        }
      ]
    }
  ],
  "items": [
    {
      "applicableLayouts": [
        "fireplace-wall",
        "door-wall",
        "window-wall"
      ],
      "applicableStyles": [
        "cabinet-shelves"
      ],
      "authoritativeDefaultSource": null,
      "authoritativeRangeSource": null,
      "authorityStatus": "customer-live",
      "blocker": null,
      "customerVisibility": {
        "interactive": true,
        "surface": "accepted shared step navigation",
        "visible": true
      },
      "id": "JQ-UX-JOURNEY-001",
      "implementationStatus": "implemented",
      "label": "Accepted four-step application journey",
      "liveModelFeasibility": {
        "affectedModelRegion": "none",
        "reason": "Journey architecture does not mutate the model.",
        "status": "not-applicable"
      },
      "modelRegion": "none",
      "pendingDecision": null,
      "persistence": {
        "navigation": "not-applicable",
        "reload": "not-applicable",
        "reset": "not-applicable",
        "savedProject": "not-applicable",
        "scope": "none",
        "staleValue": "drop"
      },
      "source": {
        "commit": "109e5cf6c420725ec872530d4809675f4a09c7e6",
        "date": "2026-08-20",
        "reference": "guided-configurator.js STEP_DEFINITIONS and accepted four-step navigation",
        "type": "accepted repository configuration"
      },
      "testId": "V4-AUTH-JOURNEY-001",
      "units": "none"
    },
    {
      "applicableLayouts": [
        "fireplace-wall",
        "door-wall",
        "window-wall"
      ],
      "applicableStyles": [
        "cabinet-shelves"
      ],
      "authoritativeDefaultSource": null,
      "authoritativeRangeSource": null,
      "authorityStatus": "standardized-hidden",
      "blocker": null,
      "customerVisibility": {
        "interactive": false,
        "surface": "none",
        "visible": false
      },
      "id": "JQ-UX-MINIMAL-001",
      "implementationStatus": "implemented",
      "label": "Minimal relevant screen content",
      "liveModelFeasibility": {
        "affectedModelRegion": "none",
        "reason": "Presentation policy.",
        "status": "not-applicable"
      },
      "modelRegion": "none",
      "pendingDecision": null,
      "persistence": {
        "navigation": "not-applicable",
        "reload": "not-applicable",
        "reset": "not-applicable",
        "savedProject": "not-applicable",
        "scope": "none",
        "staleValue": "drop"
      },
      "source": {
        "authority": "John Quinn written requirements",
        "date": "2026-07-17/2026-07-18",
        "reference": "Gmail thread ‘Some stuff’, thread 19f6cf838a5ad0dc",
        "type": "John Quinn email"
      },
      "testId": "V4-AUTH-MINIMAL-001",
      "units": "none"
    },
    {
      "applicableLayouts": [
        "fireplace-wall",
        "door-wall",
        "window-wall"
      ],
      "applicableStyles": [
        "cabinet-shelves"
      ],
      "authoritativeDefaultSource": null,
      "authoritativeRangeSource": null,
      "authorityStatus": "customer-live",
      "blocker": null,
      "customerVisibility": {
        "interactive": true,
        "surface": "shared model stage",
        "visible": true
      },
      "id": "JQ-UX-MODEL-NAV-001",
      "implementationStatus": "implemented",
      "label": "Model preview navigation",
      "liveModelFeasibility": {
        "affectedModelRegion": "camera",
        "reason": "Accepted viewer navigation changes only the camera and never project parameters or model geometry.",
        "status": "proven"
      },
      "modelRegion": "camera only",
      "pendingDecision": null,
      "persistence": {
        "navigation": "persist",
        "reload": "persist",
        "reset": "authority-backed default",
        "savedProject": "persist",
        "scope": "session-camera",
        "staleValue": "reject or normalize without cross-layout effects"
      },
      "source": {
        "commit": "109e5cf6c420725ec872530d4809675f4a09c7e6",
        "date": "2026-08-20",
        "reference": "guided-layout-viewer.js camera/orbit controls and configurator.html accessible viewer shell",
        "type": "accepted repository configuration"
      },
      "testId": "V4-UX-MODEL-NAV-001",
      "units": "none"
    },
    {
      "applicableLayouts": [
        "fireplace-wall",
        "door-wall",
        "window-wall"
      ],
      "applicableStyles": [
        "cabinet-shelves"
      ],
      "authoritativeDefaultSource": null,
      "authoritativeRangeSource": null,
      "authorityStatus": "customer-live",
      "blocker": null,
      "customerVisibility": {
        "interactive": true,
        "surface": "accepted site header and local project dialogs",
        "visible": true
      },
      "id": "JQ-UX-LOCAL-PROJECT-001",
      "implementationStatus": "implemented",
      "label": "Local project save and resume",
      "liveModelFeasibility": {
        "affectedModelRegion": "none",
        "reason": "Existing local/project serialization only; no backend or account behavior.",
        "status": "not-applicable"
      },
      "modelRegion": "none",
      "pendingDecision": null,
      "persistence": {
        "navigation": "persist",
        "reload": "persist",
        "reset": "authority-backed default",
        "savedProject": "persist",
        "scope": "local-project",
        "staleValue": "reject or normalize without cross-layout effects"
      },
      "source": {
        "commit": "109e5cf6c420725ec872530d4809675f4a09c7e6",
        "date": "2026-08-20",
        "reference": "configurator.html local Save Project/My Projects chrome and guided-configurator-state.js local serialization behavior",
        "type": "accepted repository configuration"
      },
      "testId": "V4-UX-LOCAL-PROJECT-001",
      "units": "none"
    },
    {
      "applicableLayouts": [
        "fireplace-wall",
        "door-wall",
        "window-wall"
      ],
      "applicableStyles": [
        "cabinet-shelves"
      ],
      "authoritativeDefaultSource": null,
      "authoritativeRangeSource": null,
      "authorityStatus": "customer-live",
      "blocker": null,
      "customerVisibility": {
        "interactive": true,
        "surface": "accepted site header and menu",
        "visible": true
      },
      "id": "JQ-UX-SITE-NAV-001",
      "implementationStatus": "implemented",
      "label": "Accepted site navigation",
      "liveModelFeasibility": {
        "affectedModelRegion": "none",
        "reason": "Accepted navigation infrastructure; it does not add a product parameter.",
        "status": "not-applicable"
      },
      "modelRegion": "none",
      "pendingDecision": null,
      "persistence": {
        "navigation": "persist",
        "reload": "persist",
        "reset": "authority-backed default",
        "savedProject": "persist",
        "scope": "site-navigation",
        "staleValue": "reject or normalize without cross-layout effects"
      },
      "source": {
        "commit": "109e5cf6c420725ec872530d4809675f4a09c7e6",
        "date": "2026-08-20",
        "reference": "configurator.html site header, skip link and configurator menu",
        "type": "accepted repository configuration"
      },